,Title,Distance,Explain,DriveCourseID,Image,LocalID,URL
144,화양조발대교,,"화양조발대교는 여수시에서 고흥군으로 가는 백리섬섬길 위에 놓인 첫 번째 대교이다. 2020년 적금대교, 둔병대교, 낭도대교와 함께 공식 개통하였다. 다이아몬드형 2주탑으로 다리 길이는 854m, 주탑 높이는 170m이며, 교각과 교각 사이 거리를 나타내는 경간장의 최대 길이는 500m이다.
화양조발대교의 콘셉트은 [가연지교]로 [아름다운 인연이 있는 다리]라는 뜻으로, 미래의 길을 열어서 아름다운 인연을 이어간다는 의미를 담고 있다. 여수의 백리섬섬길을 완성하는 대교 중 하나로, 백리섬섬길은 섬과 섬을 연결하는 교량을 세워 10개의 섬을 11개의 해상교량으로 연결한 백 리 길(39.1㎞)이다.
이 밖에도 여수 낭만버스 시티투어버스 브리지 코스에 포함되어 있다. 여수 주요 관광지를 둘러볼 수 있는 코스로, 그 중 제2코스인 브리지 코스에 속한다. 여수와 고흥을 잇는 11개 다리 중 5개 대교인 화양조발대교, 적금, 둔병, 팔영, 낭도 대교를 둘러볼 수 있다.",145,https://cdn.visitkorea.or.kr/img/call?cmd=VIEW&id=7b2f0b3a-466a-4291-8dc0-69c182c04a7f,7,https://korean.visitkorea.or.kr/detail/ms_detail.do?cotid=126ffbf1-0219-4743-b9ee-4f1f066f022f&big_category=A02&mid_category=A0205&big_area=38
145,한천저수지,,"한천저수지는 공주 여행 시에 드라이브 삼아 잠시 들러 쉬어가기 좋은 곳이다. 자전거 레포츠를 즐기는 사람들도 한천저수지 앞에서 기념 사진을 남기기도 한다. 한국농어촌공사 충청남도본부 공주지사에서 관리하고 있는 한천저수지는 수심이 깊어 빙어가 서식하고 있으며, 인근에 공장이나 축산 농가도 거의 없다. 2021년 8월 현재 낚시 금지 구역으로 지정하기 위한 행정절차가 진행 중이다.",146,https://cdn.visitkorea.or.kr/img/call?cmd=VIEW&id=7de2215c-4695-418f-9079-64fbfdbb40fc,3,https://korean.visitkorea.or.kr/detail/ms_detail.do?cotid=17b16c75-3e82-41a6-8f58-25c29534a4f0&big_category=A01&mid_category=A0101&big_area=34
146,영광풍력발전단지,,"전국에서 손꼽히는 드라이브코스인 백수해안도로를 달리다 보면 풍력발전단지를 만나게 된다. 논밭 사이로 하얀 풍력발전기 총 78기가 설치되어 있으며 이 중 우리나라 최대 크기의 풍력발전기가 연구, 테스트 중이라고 한다.
드라이브를 하며 이국적인 풍력 발전단지를 즐기거나 잠시 들러 풍력발전기 주변을 가볍게 산책하며 압도적인 분위기를 느낄 수 있다. 영화 독전의 촬영지이기도 하다.
광활한 논 사이에 설치된 풍력 발전기의 풍경은 환한 대낮에도 멋진 풍광이지만, 들판을 지나 끝자락에 위치한 백수분등소공원에서 즐기는 풍력단지의 풍광 또한 색다르다.
해 질 녘 노을 진 바닷가를 배경으로 풍력발전기가 서있는 아름다운 풍경은 우리나라에서 보기 드문 일몰 풍경이다.
봄이면 도로 중간중간에 펼쳐진 노란 유채꽃 배경과 여름이 되면 초록의 논 배경과 해안가의 칠면초가 만들어내는 붉은 배경, 가을이면 황금빛 들녘과 어우러지는 하얀 풍력발전기는 그 색 대비만으로도 사진 찍기 좋은 포토존이 된다.
가까이에서 바라보면 풍력발전기의 프로펠러가 회전하는 소리가 비현실적으로 느껴지고 풍력발전기의 엄청난 크기에 압도된다.
차량을 이용하여 내가 원하는 구간에 멈춰 구경할 수 있으나 사진촬영을 하기 위해 논, 밭에 무단으로 들어가는 행동은 삼가해야 한다.",147,https://cdn.visitkorea.or.kr/img/call?cmd=VIEW&id=53242bcc-e1b4-492d-96ef-864870972175,7,https://korean.visitkorea.or.kr/detail/ms_detail.do?cotid=1e2d2293-1988-415e-b05f-967b4443f219&big_category=A02&mid_category=A0204&big_area=38
147,오로저수지,,"오로저수지는 경북 구미시 장천면에 자리 잡고 있다. 여러 어종이 서식하고 있어 많은 낚시객이 방문했지만, 2021년 10월 현재 낚시 금지 구역으로 지정됐다. 이 때문에 드라이브를 하거나 자전거를 타며 풍경을 감상하는 사람이 많다. 저수지는 군위IC와 가깝고, 주변에 구미 CC, 문수 산림욕장이 위치해 있어 연계 관광에 나서기 수월하다.",148,https://cdn.visitkorea.or.kr/img/call?cmd=VIEW&id=6c084ab4-791e-4497-84e4-718e20760d4a,6,https://korean.visitkorea.or.kr/detail/ms_detail.do?cotid=2e8d1024-d87b-4c60-8db5-beaf803acbe1&big_category=A01&mid_category=A0101&big_area=35
148,숙암계곡,,"숙암계곡은 상원산과 가리왕산을 휘감고 도는 총연장 10km의 계곡이다. 오대천 상류에 위치한 계곡으로, 울창한 산림과 맑은 물이 흐르는 아름다운 자연경관을 자랑한다. 이곳은 강원도의 대표적인 계곡으로 숙암이라는 이름은 옛날 어느 원님이 하룻밤을 묵어갈 민가조차 없어 바위에서 노숙했다는 데서 유래되었다 한다.
강변길은 드라이브 코스로 널리 알려져 있으며, 특히 숙암샘터의 가리왕산 샘물은 차고 깨끗한 생수로 유명하다. 크고 작은 폭포와 소가 여러 개 있는데, 상류에 위치한 숙암폭포는 높이 20m의 거대한 폭포로 계곡의 백미로 꼽힌다. 숙암계곡은 봄과 가을에 가장 아름답다. 봄에는 푸른 잎으로, 가을에는 단풍으로 물든 계곡의 모습을 감상할 수 있다. 잘 조성된 등산로를 따라서 여유롭게 계곡의 아름다운 비경을 즐길 수 있다. 상류에 위치한 숙암서원은 숙암 이암룡 선생의 학문과 덕행을 기리기 위해 세운 서원으로, 계곡의 역사적 가치를 더해준다.
주변에 장전계곡, 로미지안가든, 백석폭포 등 다양한 관광명소들이 있어 함께 둘러보면 좋다.",149,https://cdn.visitkorea.or.kr/img/call?cmd=VIEW&id=f7d9c790-9def-47af-b8c0-7f73cfdaf34f,2,https://korean.visitkorea.or.kr/detail/ms_detail.do?cotid=37b35fbe-047c-4126-a907-c118e3de97f2&big_category=A01&mid_category=A0101&big_area=32
149,성산세화해안도로,,"제주도 동쪽 끝자락의 해안을 따라 형성된 해안도로로, 구좌읍 세화리에서 서귀포시 성산읍 성산리까지 이어진다. 총 길이는 15.8km로 제주도 해안도로 중 가장 길이가 길며, 아름답기로 유명해 사람들이 많이 찾는다. 바다를 끼고 길게 이어지는 해안도로를 따라 자전거 전용도로가 마련돼 있어 드라이브를 즐기려는 관광객뿐만 아니라 자전거 타기와 하이킹을 하는 사람들도 많이 찾는다. 주변 관광지로는 외세의 침입에 대비해 조선 시대에 축조한 성곽인 별방진, 넓은 백사장과 맑은 바닷물을 자랑하는 하도해수욕장, 세화해수욕장 등이 있다.",150,https://cdn.visitkorea.or.kr/img/call?cmd=VIEW&id=741f5d91-8d24-4b16-8610-288c2b7e3a5a,9,https://korean.visitkorea.or.kr/detail/ms_detail.do?cotid=40f338b6-9195-481e-9bc8-c5c93b236d4a&big_category=A01&mid_category=A0101&big_area=39
150,시화호,,"시화호는 경기도 시흥시, 안산시, 화성시에 만들어진 인공호수이다. 시화호란 명칭은 전체 방조제의 양 끝인 시흥시와 화성시의 앞 글자를 따서 지어진 것이다.
시화호는 한때 수질 오염 때문에 많은 문제가 있었지만, 수질의 지속적인 개선 및 관리 체계 마련, 시화호 생태계 복원과 관리를 통한 유역의 자원 이용 극대화 등 시민들이 안심하고 이용할 수 있는 공간으로 만들기 위하여 체계적으로 관리하여 큰고니, 알락꼬리마도요, 꼬마물떼새, 노랑부리저어새, 검은머리물떼새 등 천연기념물로 보호되고 있는 새들과 갯벌 생물들이 서식하는 곳이 되었다.
시화호 중간에 설치된 조력발전소는 인구 50만 도시의 가정에 공급할 수 있다. 시화방조제 도로를 달리다 보면 만날 수 있는 시화나래 휴게소는 주말이면 시화방조제 일대를 한눈에 조망할 수 있는 달전망대를 찾는 사람들로 북적인다. 시화나래 달전망대는 시화호와 서해를 조망할 수 있는 지역의 랜드마크로 높이 75m에서 내려다보는 풍경은 압도적이며, 우주비행선을 닮은 조망대는 강화 유리로 되어 있어 바닥이 훤히 보인다.
달전망대 아래에는 서해 물결과 신재생에너지의 순환을 주제로 건설과정에서 발생한 토사들을 이용하여 친환경적으로 만든 해상공원인 시화나래 조력공원이 있어 산책코스로 돌아보기 좋다.",151,https://cdn.visitkorea.or.kr/img/call?cmd=VIEW&id=e826b90f-a5e1-4c6a-a1f3-c4d9ef09ebb3,1,https://korean.visitkorea.or.kr/detail/ms_detail.do?cotid=471c186b-f85c-41df-b69d-ecdae7257b37&big_category=A01&mid_category=A0101&big_area=31
151,사정저수지,,사정저수지는 충북 음성군 음성읍에 있다. 저수지는 드라이브나 산책 삼아 가볍게 둘러보기 좋다. 저수지는 음성 IC에서 가까운 거리에 있다.,152,https://cdn.visitkorea.or.kr/img/call?cmd=VIEW&id=5385da9a-9ae2-4e92-8028-a4c85528b899,3,https://korean.visitkorea.or.kr/detail/ms_detail.do?cotid=57063d5f-8963-4a5c-838f-33973d26334d&big_category=A01&mid_category=A0101&big_area=33
152,백리벚꽃길,,"백 리 벚꽃길은 합천 읍내에서 1026번 지방도를 따라 대병면 방향, 합천영상테마파크 주변부터 합천댐을 거쳐 봉산면에 이르기까지 호반도로가 벚꽃으로 뒤덮인 곳으로 매년 4월 초 벚꽃이 만개할 때 드라이브를 즐기기에 좋다. 합천호를 따라 드라이브를 하거나 산책을 하면서 만나는 벚꽃나무의 행렬은 눈을 뗄 수 없이 아름답다. 차량에 승차한 채 흩날리는 벚꽃 내음을 충분히 즐길 수 있고 인적 드문 곳에서 잠깐 내려 신선한 봄 공기를 한껏 마실 수 있는 안심 관광지다.",153,https://cdn.visitkorea.or.kr/img/call?cmd=VIEW&id=e0d27447-51f3-4ec0-aa38-5ce3cc6559cb,5,https://korean.visitkorea.or.kr/detail/ms_detail.do?cotid=66cb6464-5836-4534-8da0-0235c2a055c4&big_category=A01&mid_category=A0101&big_area=36
153,담양 메타세쿼이아길,,"메타세쿼이아 가로수길은 이국적이며 환상적인 풍경을 만들고 있다. 이곳은 원래 24번 국도였는데 이 국도 바로 옆으로 새롭게 국도가 뚫리면서 군청~금성면 원율삼거리 5km 구간에 5년생 1,300본을 식재하여 조성한 길이다. 가로수길의 총길이는 약 8.5km로, 도로를 사이에 두고 양쪽 길가에 높이 10~20m의 메타세쿼이아가 심어져 있다.

메타세쿼이아길을 가다 보면 이국적인 풍경에 심취해 나도 모르는 사이에 남도의 길목으로 빠져들고 만다. ‘꿈의 드라이브코스’라고 불리는 이곳은 마치 초록빛 동굴에 온 것만 같은 느낌이며, 푸른 녹음이 한껏 자태를 뽐내는 여름이 드라이브하기에 가장 좋다. 이러한 아름다움으로 인해 산림청과 생명의 숲 가꾸기운동본부 등에서 주관한 ‘2002 아름다운 거리숲’ 대상을 수상했고, 2006년 건설교통부 선정 ‘한국의 아름다운 길 100선’의 최우수상을 수상하기도 했다.",154,https://cdn.visitkorea.or.kr/img/call?cmd=VIEW&id=72046952-ba47-42b3-ad2b-d38d28f96805,7,https://korean.visitkorea.or.kr/detail/ms_detail.do?cotid=6e6fad62-1c2a-43ec-8cd9-760e662d8fc7&big_category=A02&mid_category=A0203&big_area=38
154,도마령,,"도마령은 영동군 황간에서 전북 무주로 넘어가는 고갯길이다. 영동 최고봉 민주지산(해발 1,241m) 자락에 있는 해발 800m의 높은 고갯길로 칼을 든 장수가 말을 타고 이곳을 넘었다고 해서 도마령이라 이름 지었고, 답마령이라는 옛 이름도 전해진다.
도마령에 가면 고갯마루 위에 정자 상용정이 있다. 2002년과 2003년 태풍으로 영동군 곳곳이 재해를 입었는데 이때 복구 사업을 하면서 상용정을 세웠다. 상용정은 전통한식의 목조구조의 와가팔각정으로 이익공식 공포로 시공하여 그 웅장함을 더하였다. 목재는 우리나라 소나무를 사용하였으며 화강암 암장 초석에는 우리나라 대표적 국악기인 대금을 형상화하였는데 국악의 고장 영동의 명소임을 암시하는 대목이다. 전통양식의 멋스러운 이 팔각정의 풍광은 이루 말할 수 없이 시원하고 고개를 오르내리는 도마령 길은 구절양장 춤을 추며 상촌으로 용화로 뻗어 가는데 그 풍경이 조화롭다.
또한 구불구불 굽이진 도로가 드라이브 코스로 최근 유명세를 타고 있다. 영화 [집으로]의 촬영지로 시골 풍경과 정겨운 인심이 가득한 영화의 한 장면이 떠오르는 곳이다. 비포장도로를 포장해서 2차선 도로가 되었고 구불거리는 도로 주변으로 민주지산의 수려한 풍광이 펼쳐져 눈이 즐겁고 마음이 편안해진다. 민주지산의 숲길에서 라이딩을 즐기는 사람들도 많다.",155,https://cdn.visitkorea.or.kr/img/call?cmd=VIEW&id=3634c4cd-3b66-4a88-9805-7de2f5ebd1c0,3,https://korean.visitkorea.or.kr/detail/ms_detail.do?cotid=77b588df-259b-4f54-bab4-755df2e6bc2e&big_category=A02&mid_category=A0201&big_area=33
155,정자항,,"옛날 표구에 정자나무 스물네 그루가 있어서 정자항이라는 이름을 얻게 된 관광어항이다. 강동사랑길 1구간 코스이 이 곳 정자항 귀신고래 등대에서 시작된다. 북방파제와 남방파제 두 곳이 있으며 대게 가게가 모여있는 대게거리와 활어직판장도 있다. 정자항 북쪽으로 이어서 강동몽돌해변(정자해변)이 펼쳐진다.
2010년 세워진 정자항 남방파제등대에는 하얀 귀신고래를 형상화한 등대가, 북방파제등대는 붉은 귀신고래 등대가 조형물로 재탄생되었다. 이곳 정자항을 비롯한 우리나라 울산 부근 울산귀신고래 회유해면은 고래사냥으로 멸종위기에 처해있던 귀신고래가 새끼를 낳기 위해 이동하는 경로로 1962년부터 천연기념물로 지정되어 관리되고 있는 곳이다.
북방파제 근처에는 정자 활어 직매장과 대게 가게들이 모여있어 식사도 하고 남목-주전-정자-강동으로 이어지는 해변도로 드라이브도 하고 바다를 보면서 산책도 하기 좋은 전국적으로 유명한 일출 명소이다. 또한 정자항은 전국 최대의 참가자미 집산지로 싱싱한 생선회를 저렴하고도 푸짐하게 맛볼 수 있는 곳으로 소문난 정자항에는 늘 많은 관광객들로 북적인다.",156,https://cdn.visitkorea.or.kr/img/call?cmd=VIEW&id=3b8e6bc9-3e93-404e-b572-018930b60117,4,https://korean.visitkorea.or.kr/detail/ms_detail.do?cotid=801d057c-4b54-4b95-86a4-4ff65f29c71c&big_category=A01&mid_category=A0101&big_area=7
156,월정리해안도로,,"월정리 해안도로의 정식 명칭은 ''김녕오조 해안도로''로 김녕에서부터 성산 오조리까지 이어지는 긴 해안도로다. 에메랄드빛 바다, 새하얀 백사장 해변과 행원리의 풍력발전기도 볼 수 있으며, 올레 20코스의 일부가 이 도로를 지난다. 다른 해안도로보다 굴곡이 심해 수채화 빛 바다가 움직이는 그림처럼 보인다. 바람은 풍력발전기를 돌리고, 스노클링과 서핑, 요트, 카약 등 해양 액티비티를 즐기는 사람도 많다. 월정리 해변에는 기존 제주도 전통 가옥을 리모델링해서 오픈한 식당과 카페가 많아 사진을 찍기 좋다. 제주에서 꼭 달려봐야 할 해안도로 중 하나다.",157,https://cdn.visitkorea.or.kr/img/call?cmd=VIEW&id=64edf0d6-ff0a-4a96-b855-a165e850b068,9,https://korean.visitkorea.or.kr/detail/ms_detail.do?cotid=98d44088-01e0-4cc2-90e3-314f88511d72&big_category=A01&mid_category=A0101&big_area=39
157,노동 저수지,,"노동저수지는 도시 생활권의 훼손되고 방치된 공간을 복원하여 습지, 개울, 초지, 숲 등 다양한 생물서식처를 조성함으로써 도시의 생물다양성을 증진 하면서 시민에게 쾌적한 생태휴식공간을 제공하기위해 추진된 고창 자연마당 조성사업의 일환으로 2016년 ~ 2018년에 사업면적 66.11m2로 조성되었다.
노동저수지는 수목원, 유아체험원, 관찰데크, 탐조테크, 숲체험원, 자연마당데크 등 다양한 공간으로 자연을 느낄 수 있으며 제19회 자연환경대상 공모전에서 대상인 환경부장관상을 수상하였다.
노동저수지 수상길은 저수지 물 위에 떠 있는 데크로 수위 변동에 따라 뜨거나 가라앉는 구조로 되어있어 시작점 도교는 수위가 낮을 때는 경사가 급해진다. 탐방길으 노동수상길 0.44km, 자연마당 0.3km, 전불길 3.6km로 중간에 부위분수, 조망다리, 휴게공간 등이 있어 아름다운 자연과 함께 힐링 산책을 즐길 수 있다.",158,https://cdn.visitkorea.or.kr/img/call?cmd=VIEW&id=90b86b68-4383-4fd0-bd53-129e613f06eb,8,https://korean.visitkorea.or.kr/detail/ms_detail.do?cotid=ac1d8f1b-7b0f-432a-b9a3-92e934f586a1&big_category=A01&mid_category=A0101&big_area=37
158,팔당호,,"팔당호는 경기도 광주시 퇴촌면과 남종면에 걸쳐있는 인공 호수로 1973년 팔당댐 완공 이후, 약 2억 5천만 톤의 물을 저수하고 있다. 팔당호에는 서울, 경기지역에 수돗물을 공급하는 취수장이 있으며, 호반 주변 일대에서 바라보는 호수의 경관이 빼어나 팔당댐을 중심으로 광주의 관광명소가 되고 있다.
특히, 〔팔당호 드라이브 코스〕는 남한산성을 관통하는 지방도 코스로 광주시 남종면 귀여리에서 수청리까지 337번 지방도 12km 구간을 말하며 경기도에서 선정한 5대 벚꽃 드라이브 코스로 유명하다. 길 옆으로 약 3,000여 그루의 벚나무가 팔당호와 함께 어우러져 감탄을 자아내 봄이면 벚꽃놀이를 위한 방문객들로 일대가 북적인다. 경기도 수자원본부 건물 9층에는 팔당전망대가 있으며 이곳에서는 팔당호의 아름다운 모습을 한눈에 담아볼 수 있다.",159,https://cdn.visitkorea.or.kr/img/call?cmd=VIEW&id=edf48bc0-3f8f-4646-a21a-6d651b8f1e2e,7,https://korean.visitkorea.or.kr/detail/ms_detail.do?cotid=eb3f07b4-04b2-45e7-a9d2-f8dafa9dbec5&big_category=A01&mid_category=A0101&big_area=31
159,남포방조제,,"남포방조제는 보령시 남서부 해안에 간척지를 만들기 위해 서해로 유입되는 남포천을 막아 축조한 방조제이다. 이 방조제는 길이가 3.7km에 이르러 드라이브 코스로 제격이다. 방조제 중간 지점에는 과거 섬이었다가 방조제로 인해 육지로 연결된 죽도가 자리 잡고 있다. 죽도에는 입구 팔각정을 세워 휴식 공간을 마련하였는데, 이곳에서는 남포평야, 죽도뿐만 아니라 동쪽 내륙 멀리 성주산, 옥마산 등도 보인다. 방조제 남쪽 끝에는 보령요트경기장이 있어 항해하는 요트를 구경할 수도 있다.
남포방조제는 국도 36호선, 21호선, 지방도 606호선에서 지방도 607호선을 통해 접근할 수 있으며, 서해안고속도로 대천IC 및 무창포IC가 가깝다. 주변에는 죽도 외에 최고운유적, 보령요트경기장, 대천해수욕장, 용두해수욕장 등이 있다.",160,https://cdn.visitkorea.or.kr/img/call?cmd=VIEW&id=06410608-051d-4258-8ba4-9fe8b361df1b,3,https://korean.visitkorea.or.kr/detail/ms_detail.do?cotid=eb7a91be-23df-4496-b945-0da418eb956a&big_category=A01&mid_category=A0101&big_area=34
160,대부도 메타세콰이어길,,"대부도 메타세콰이어길은 경기도 안산시 단원구 대부북동에 있다. 대부바다향기 테마파크 외곽도로에 약 3.5km 구간에 1,200주의 메타세콰이어가 길게 이어진 산책로 양옆으로 심겨 있다. 메타세콰이어는 나무에서 뿜어져 나오는 산소와 피톤치드가 풍부하다. 여유롭게 산책할 수도 있고 자전거, 스쿠터, 전동카트 등을 빌려 둘러볼 수도 있다. 메타세콰이어길 옆으로 대부바다향기 테마파크의 화훼단지가 보인다. 대부바다향기 테마파크를 함께 둘러보기 좋다. 무료 주차장이 있어 편하게 이용할 수 있다. 대부도 여행지로 유명하다.
※반려동물 동반 가능 (단, 개 목줄 착용, 배설물 처리를 위한 비닐봉지 등을 구비한 이용객만 허용)",161,https://cdn.visitkorea.or.kr/img/call?cmd=VIEW&id=b6068e22-451a-4849-b83a-0b66374132ee,1,https://korean.visitkorea.or.kr/detail/ms_detail.do?cotid=ef4896cb-019f-4575-b6db-63cae0f054fa&big_category=A01&mid_category=A0101&big_area=31
161,무지갯빛 해안도로,,"사천 무지갯빛 해안도로는 용현면 송지리 부터 대포동 일원으로 펼쳐진 3km 드라이브 코스다. 알록달록한 경계석을 배경으로 사진을 찍기 위해 많은 관광객들이 방문하고 있다. 무지갯빛 해안도로는 시민들과 관광객들에게 색다른 볼거리를 제공하고, 거북선마을과 대포항 등 여러 관광지와 연계하여 관광하기에 매우 좋다.",162,https://cdn.visitkorea.or.kr/img/call?cmd=VIEW&id=7f5caad1-6aea-4d04-8458-e0373d6b238f,5,https://korean.visitkorea.or.kr/detail/ms_detail.do?cotid=ef65c52f-c8ac-4cd4-b616-a63cc33519de&big_category=A01&mid_category=A0101&big_area=36
162,국립 유명산자연휴양림,,"청평댐을 지나 청평 호수를 끼고 달리는 길은 드라이브 코스로 최적이며, 설악면 소재지에서부터 자연휴양림까지 가는 길에선 정겨움을 느낄 수 있다.
기암괴석과 계곡의 맑은 물을 따라 유명산 산행을 하다 보면 완만하면서도 급한 등산로가 교차되어 지루하지 않으며, 2.8km의 산책로와, 숲속 수련장, 자생식물원과 멋진 통나무집은 현대인에게 색다른 정취를 제공한다.
또한 대자연과 자생식물원은 자라나는 청소년들에게 숲에 대한 이해 및 자연보호 사상 고취, 호연지기 등을 기르는 자연 학습 교육장으로 더할 나위가 없는 곳이다. 서울 근교에 위치해 접근성이 뛰어나고, 휴양림 주변에 많은 관광지가 함께 자리하고 있다.
우리나라에서 자생하는 꽃들이 집단으로 식재되어 있는 약 79,338㎡ 규모의 자생식물원(목본 42종, 초본 322종)을 보유해 휴양과 더불어 자연 교육과 생태 교육을 병행하는 전국 유일의 자연휴양림이라 할 수 있다.
향로 식물원, 암석원, 자연학습원, 우리꽃 길, 습지 식물원, 잔디 광장이 조성되어 있고, 무료 숲 해설, 산림 치유 프로그램, 목공예 체험 프로그램 등 휴양림 보유 서비스가 준비되어 있다.
그 외에도 어린이나 가족을 위한 다양한 프로그램이 준비되어 있고, 3~8인실의 숙박시설들과 5,6인이 사용할 수 있는 야영장도 잘 꾸며져 있다.",163,https://cdn.visitkorea.or.kr/img/call?cmd=VIEW&id=fadf4f6c-fd56-48a7-a12c-bfc2c2125df0,1,https://korean.visitkorea.or.kr/detail/ms_detail.do?cotid=f8435b42-46ca-425b-a0e3-3598a9c9a7ca&big_category=A01&mid_category=A0101&big_area=31
163,성주댐(성주호),,"금수면 봉두리에 위치한 성주댐은 1992년 완공되었으며, 댐높이 60m, 제방길이 430m, 면적 3,530㏊에 총 3,800만 톤의 저수량을 보유하고 있다. 성주군과 고령군에 농업용수를 공급하고 있다. 성주댐을 끼고 도는 약 7km의 도로는 드라이브 코스로 유명한데, 자연과 인간과 자동차가 조화를 이루어 아름다운 추억을 만들 수 있는 곳이다. 성주호 주변에는 수몰지역 내의 문화재를 옮겨놓은 영모재와 구강재가 있으며 운봉 현황호 선생의 뜻을 기리기 위해 제자들이 세운 ‘백운정’을 비롯해 가야산·독용산성 등의 볼거리가 있다.",164,https://cdn.visitkorea.or.kr/img/call?cmd=VIEW&id=077f6a9e-b020-4000-a554-a0dedd19e924,6,https://korean.visitkorea.or.kr/detail/ms_detail.do?cotid=0b29686b-7e19-41c8-9977-e1520cffc4f5&big_category=A02&mid_category=A0205&big_area=35
