,Title,Distance,Explain,DriveCourseID,Image,LocalID,URL
264,남면 벚꽃길,,"남면 벚꽃길은 달산포 교차로부터 남면사무소까지로 벚꽃길 거리는 약 3km 정도 된다. 이곳의 벚나무들은 남면 주민들이 직접 식재하여 조성한 곳이다.
태안의 벚꽃 개화 시기는 다른 지역에 비해 늦게 시작되는데, 삼면이 바다로 둘러싸인 태안은 해양성 기후 때문에 내륙보다 벚꽃이 2주 정도 늦게 핀다. 남면 벚꽃길에는 주차장이 따로 없지만, 차들이 거의 없기 때문에 달산포해수욕장 입구에 잠시 차를 세워두고 사진도 찍으며 한적하게 벚꽃을 즐길 수 있는 장점과, 달산포해수욕장이 바로 옆에 있어서 서해를 붉게 물들이는 노을을 함께 즐길 수 있다는 장점이 있다. 남면 벚꽃길은 태안 남면 동사무소를 검색하고 지나면 된다. 2차선 도로로 인도가 따로 없으니, 차로 이동하면서 벚꽃 여행을 즐기기를 추천한다.
남면 벚꽃길 주변으로 몽산포해수욕장, 달산포해수욕장, 청포대해수욕장, 마검포해수욕장이 이어지고 있어 연계해서 둘러보는 것도 좋다.",265,https://cdn.visitkorea.or.kr/img/call?cmd=VIEW&id=aee02103-6e79-42fd-b105-f1092dd03670,3,https://korean.visitkorea.or.kr/detail/ms_detail.do?cotid=c6a14402-bbfc-4813-9e9c-48d1840b94a5&big_category=A01&mid_category=A0101&big_area=34
265,지리산 가는길,,한국의 아름다운 길 100선에 선정된 길 중 하나로 함양읍에서 지리산 제일문 부근까지 약 12km를 지리산 가는길이라고 한다. 지리산 가는길은 지안재와 오도재를 거쳐 마천으로 향하면 지리산 제일문과 지리산 조망공원이 자리 잡고 있다. 이곳에는 지리산의 전체 능선을 한눈에 바라볼 수 있으며 법화산과 삼봉산의 등산로가 있어 많은 등산객이 찾는 곳이다. 지리산 가는길은 바이크 코스로 유명해 주말이 되면 많은 오토바이 애호가가 이곳을 찾는다. 지리산 제일문을 넘어 마천 창원 산촌생태마을을 지나면 지리산 둘레길인 금계~동강 구간의 시작점인 함양군 안내센터가 있다.,266,https://cdn.visitkorea.or.kr/img/call?cmd=VIEW&id=3be9e464-d182-4944-80b1-a065d43fc27b,5,https://korean.visitkorea.or.kr/detail/ms_detail.do?cotid=c82d5931-b5b1-4488-b522-5978ad0f62b2&big_category=A01&mid_category=A0101&big_area=36
266,종달리수국길,,"제주도 북동쪽 구좌읍에 자리한 조용한 마을 종달리에는 종달리 수국길이라는 테마 거리가 형성되어 있다. 종달리는 제주 국제공항에서 동부 방향으로 약 1시간 정도 거리에 있으며, 비자림을 지나 지미봉 자락에서 만나게 되는 마을이다. 보통 6월 중순에서 6월 말, 늦으면 7월 말까지 종달리 바닷길을 따라 형형색색의 수국이 만개한 모습을 볼 수 있다. 수국은 흙의 산도에 따라 하늘색에서 분홍색까지 색이 달라진다. 다만 이 테마 거리는 도로 한쪽으로 자전거도로 겸 인도가 마련되어 있지만, 차가 지나다니는 도로변이니 조심해야 한다.",267,https://cdn.visitkorea.or.kr/img/call?cmd=VIEW&id=c086e218-6cc4-40a7-862e-872b62fc73d1,9,https://korean.visitkorea.or.kr/detail/ms_detail.do?cotid=d2c7abaf-f7d7-419f-8a85-02b0fbbb697d&big_category=A01&mid_category=A0101&big_area=39
267,횡성자연휴양림,,"횡성자연휴양림은 횡성군 갑천면에 있는 사립 휴양림으로 산과 계곡의 자연경관을 즐길 수 있는 곳이다. 꽃이 피는 나무, 단풍이 멋있는 나무, 사철나무 등을 고르게 심어 사계절 아름다운 경관을 유지하고 있으며 산책로 주변에 석상 및 조각상이 조성되어 있어 포토존으로도 좋은 볼거리를 제공하고 있다.
휴양림 내 숲속의 집이라는 숙박시설뿐 아니라 넓은 오토캠핑장과 카라반을 위한 전용 사이트가 준비되어 있으며 수영장, 골프연습장, RC 트랙, 카페 등의 부대시설이 잘 갖춰져 있다. 휴양림 내에 있는 아리조나 카페는 실제 서부 시대에 사용하던 역마차 및 오래된 캠핑 장비 등을 전시하고 있어 여러 가지 볼거리를 제공한다.
수도권 지역에서 2시간여 거리에 있고, 오는 길은 최고의 드라이브 코스라 할 만큼 아름답다. 특히 휴양 여행 벨트라고 불릴 만큼 온천, 숯가마 찜질방, 스키장, 골프장, 사격장 등이 인근에 함께 자리하고 있다.",268,https://cdn.visitkorea.or.kr/img/call?cmd=VIEW&id=124a82dc-2490-478b-8cd8-99d6e6d728a8,2,https://korean.visitkorea.or.kr/detail/ms_detail.do?cotid=d6c692bc-7d4e-40ea-8ad4-676afac65f85&big_category=A01&mid_category=A0101&big_area=32
268,의림지솔밭공원,,"의림지 솔밭공원은 제천 제1경인 ‘의림지’에서 용두산 쪽으로 도로를 따라 올라가 제2 의림지인 비룡담 저수지 둑 아래에 소나무 숲이 우거진 공원이다. 이리저리 휘며 자란 소나무들의 독특한 아름다움이 빼어난 공원으로, 숲속에 인공 물길을 만들어 물소리와 새소리를 정겹게 감상하면서 휴식할 수 있는 공간이다. 1980년대 제천시 승격 이후, 제천 의용소방대에 의해 아카시아와 돌밭의 척박한 환경에서 자라난 소나무를 의림지와 연계해서 제천의 명물로 탄생시킨 공원이다. 잔디마당을 비롯한 솔숲에 물길을 만들어 솔숲 길을 산책하기 좋아지도록 하여 시민들의 휴식처 및 각 학교(어린이집 등)들의 소풍 장소 등으로 활용되고 있다. 2020년 솔숲 내 자연형 인공수로를 만들어 여름철 물놀이를 즐길 수 있도록 하였다.",269,https://cdn.visitkorea.or.kr/img/call?cmd=VIEW&id=fe0a7b9b-b3c2-4c9f-bdd3-65ee3519686c,3,https://korean.visitkorea.or.kr/detail/ms_detail.do?cotid=dd00138d-cfa2-446d-9248-d9929d7b4dc5&big_category=A02&mid_category=A0202&big_area=33
269,한산도 망산,,"통영 한산면 한산도에 위치한 망산은 한산도의 최고봉이다. 해발 293.5m로 임진왜란 당시 망루가 있었으며 멀리 내다본다는 의미로 망산이 됐다.
망산은 등산로 주변에 이충무공 유적지가 있어 등산과 유적 탐방을 겸할 수 있는 곳이다. 산 정상에 오르면 동, 서, 남으로 점점이 떠 있는 한려수도의 수려한 섬뿐만 아니라 한산대첩 구국의 현장을 한눈에 조망할 수 있다. 망산 산행코스는 3구간이 있다. 그중에서도 제3구간 망산 정상에서 장작지로 이어지는 코스는 망산 최고의 전망을 볼 수 있어 찾는 사람이 많다. 한산도를 아우르는 망산의 등줄기를 타고 가는 능선길에서는 소나무 삼림욕을 즐길 수 있다. 한산도는 한려해상국립공원 내에 있어 풍경이 아름답고 환상의 해안 드라이브 코스로도 유명하다.",270,https://cdn.visitkorea.or.kr/img/call?cmd=VIEW&id=7a320b68-72ae-4996-b9c0-11bd20abfa94,5,https://korean.visitkorea.or.kr/detail/ms_detail.do?cotid=df334c0d-674b-40ab-b0be-928474cade41&big_category=A01&mid_category=A0101&big_area=36
270,제주 하도리 철새도래지,,"제주시 구좌읍 하도리에 있는 철새도래지로 면적은 약 0.77㎢ 정도로 바다와 인접하고 수심은 1m 정도로 영양분이 풍부한 먹잇감과 습지식물이 많아 철새들이 월동하기에 최적의 지역으로 알려진 곳이다. 천연기념물로 지정돼 있고 세계적으로 1,600여 마리 정도만 남아있다는 저어새를 비롯해 천연기념물인 고니, 매, 황조롱이 등과 환경부 멸종위기야생동물인 물수리 등이 관찰되고 있다. 매년 30종에 이르는 3,000~5,000여 마리의 철새들이 날아온다. 하도리 지미봉 기슭은 해안에 하굿둑을 축조해 저수지를 만들어 먹이가 풍부하고 둥지를 틀 수 있는 곳이 많이 있다. 망원경이 설치되어 있는 탐조대에서는 철새들의 모습을 관찰할 수 있다. 특히 이 지역은 둑을 축조하며 만든 다리의 경치가 일품이라 드라이브 코스로도 주목받고 있다.",271,https://cdn.visitkorea.or.kr/img/call?cmd=VIEW&id=eb34d660-dc5c-490e-9d76-5ce949365810,9,https://korean.visitkorea.or.kr/detail/ms_detail.do?cotid=e0ef62cb-6b28-496a-9a2f-cc4b60995307&big_category=A01&mid_category=A0101&big_area=39
271,함안경비행장 (성우항공산업),,"함안에서 경비행기로 푸른 하늘 드라이브를 즐기는 것은 특별한 경험이 된다. 남강이 흐르는 악양마을 옆 강변에 있으며, 악양 둑길 강변 비행장에 모인 경비행기를 보는 것만으로도 가슴은 두근거린다. 프로펠러가 돌고 땅 위를 미끄러지던 경비행기가 하늘로 날아오른다. 비행하는 10여 분간 하늘에서 함안의 아름다운 풍경을 두 눈에 담을 수 있다. 비행장 인근에는 악양생태공원이 조성되어 있고, 남강이 유유자적하게 흘러가고 있어, 힐링과 색다른 경험을 즐길 수 있는 여행지이다.",272,https://cdn.visitkorea.or.kr/img/call?cmd=VIEW&id=38302099-c7ef-4b1d-a679-88f78114cbd5,5,https://korean.visitkorea.or.kr/detail/ms_detail.do?cotid=e57599d5-a74b-41c7-b44e-feb1c1f60012&big_category=A03&mid_category=A0304&big_area=36
272,영도 하늘전망대,,"영도의 하늘 전망대는 경치가 좋기로 소문난 절영해안산책로에 있다. 날씨가 화창한 날엔 대마도, 거제도, 가덕도 등이 보이며 75 광장과 연결되어 있다. 바닥이 반투명한 스카이워크와 커플들이 자물쇠를 거는 곳이 마련되어 있어 연인들의 데이트 장소로 인기가 높다. 하늘 전망대라는 이름에 걸맞게 탁 트인 푸른 바다와 파란 하늘을 한눈에 담을 수 있으며, 나무 데크 길로 내려가면 해안산책길로 이어진다. 전망대 아래 해변은 스노클링을 즐길 수 있는 자갈 해변과 왕복 20분 정도 걸리는 해변 산책로가 있고, 근처에 영화""변호인"" 촬영지로도 유명한 흰여울 문화마을과 연결된다. 특히 이곳은 부산의 노을 명소로 주목받고 있으며, 주차장과 화장실이 구비되어 있다.",273,https://cdn.visitkorea.or.kr/img/call?cmd=VIEW&id=ae5675ea-a489-47c3-acb9-e50dd7f231f5,4,https://korean.visitkorea.or.kr/detail/ms_detail.do?cotid=eeb0adba-7171-4533-b647-9f99b9b96b40&big_category=A02&mid_category=A0205&big_area=6
273,만항재,,"함백산 자락에는 눈꽃 명소인 만항재와 설경이 유독 아름다운 정암사가 있다. 만항재는 강원도 정선과 태백, 영월이 경계를 이루는 고개다. 높은 고갯마루에 펼쳐진 순백의 세상과 발아래 겹겹이 물결치는 백두대간 풍경은 고갯길에서 가만히 서 바라보는 것만으로 황홀감을 안겨준다.
만항재는 천상의 화원이라는 수식어가 늘 따라다닌다. 봄부터 가을까지 다양한 야생화가 풍성하게 피어나고 이른 아침이면 안개가 밀려들어 몽환적인 풍경을 연출한다. 모든 풍경이 아름다우나 진정한 만항재의 매력은 겨울에 있다. 만항재가 자리한 곳은 함백산 줄기가 태백산으로 흘러내리다 잠시 멈춘 곳으로 해발고도가 1330m에 달한다. 고도가 높고 워낙 추운 지역이라 겨우내 환상적인 설국이 펼쳐진다. 만항재는 국내에서 차로 오를 수 있는 가장 높은 고개로도 유명하다. 힘들게 산행을 하지 않아도 아름다운 설경을 즐길 수 있다.",274,https://cdn.visitkorea.or.kr/img/call?cmd=VIEW&id=cc64aa71-d1e2-48df-8132-046146bd20ea,2,https://korean.visitkorea.or.kr/detail/ms_detail.do?cotid=f13bc253-b56d-48c9-bf3d-04f4adbc380a&big_category=A01&mid_category=A0101&big_area=32
274,두창저수지,,겨울철이면 용인 빙어축제가 열리고 차박 캠핑으로 인기가 있다. 두창 호수를 따라 걷는 둘레길은 1시간 코스로 부담 없이 걷기 적당하다. 저수지의 아름다운 풍경을 배경으로 각종 펜션과 카페가 들어서 있다. 향토유적 두창리 삼층석탑과 선돌을 볼 수 있다.,275,https://cdn.visitkorea.or.kr/img/call?cmd=VIEW&id=84812ce6-0397-4c6c-a4c8-a22ee6f7248a,1,https://korean.visitkorea.or.kr/detail/ms_detail.do?cotid=f4d06d29-27e0-44df-9359-b4c3d26d511c&big_category=A01&mid_category=A0101&big_area=31
275,금강생태공원(서천생태공원),,"금강 생태공원은 금강하굿둑 일대에 자리 잡고 있다. 이 덕분에 공원에 들어서면 금강의 수려한 풍경을 볼 수 있다. 공원에서는 잘 정비된 산책로를 따라 걸어도 좋고, 자전거 도로를 따라 자전거를 타기에도 제격이다. 또한, 다양한 조형물 앞에서 기념사진을 남길 수도 있다. 이곳은 무엇보다 해마다 겨울철이 되면 철새 군무를 감상할 수 있는 곳으로 유명해서 관광객은 물론 사진작가들의 즐겨 찾고 있다. 금강 생태공원에서 북쪽으로 가면 홍원항과 춘장대해수욕장 등 서천의 대표 관광지가 즐비하다. 게다가 공원이 군산과 가까운 거리에 위치해 군산으로 연계 여행을 떠나기도 수월하다.",276,https://cdn.visitkorea.or.kr/img/call?cmd=VIEW&id=bbba42e2-d977-44d2-a2bd-2ec7c0d89732,3,https://korean.visitkorea.or.kr/detail/ms_detail.do?cotid=f7e11f85-6db5-45b6-a7dc-e4c67d656a7f&big_category=A01&mid_category=A0101&big_area=34
276,삼랑진 양수발전소 홍보관,,"청평발전소에 이어 국내 2번째로 건설된 한국 최대 양수발전소로 1986년 4월에 준공되었다. 지하에 발전기 1, 2호기를 보유하여 총 시설용량은 60만 KW에 이른다. 상부저수지(천태호)는 높이 88미터, 하부저수지(안태호)는 높이 78미터의 사력댐으로 축조되었으며, 담수량 646만 4000㎥, 수심 27.7m로 6시간 발전이 가능하다. 양수식 발전은 전기를 생산한 후 방류하는 물을 하부 저수지에 담아두었다가 밤에 남은 전력을 이용해 상부저수지로 올려보낸 다음, 전력소비가 많은 시간에 물을 흘려보내 발전하는 방식이다. 삼랑진양수발전소에는 삼랑진양수발전소 홍보관인 [에너지팜(Energy Farm)]이 운영되고 있으며, 에너지팜에서는 에너지 발달의 역사, 전기에너지의 이용 실태 등을 소개하고 있고, 에너지팜 앞에는 수명이 다한 기동전동기와 펌프수차 샘플을 설치하여 내방객들이 관람할 수 있도록 하였다.
봄이면 4km에 달하는 안태호변의 벚꽃길 드라이브 코스는 유명한 벚꽃길로 알려져 있으며, 상부의 천태호 옆에는 천태공원이 조성되어 있다.",277,https://cdn.visitkorea.or.kr/img/call?cmd=VIEW&id=37509586-af7f-4bc4-b0d0-33bfb63a6890,5,https://korean.visitkorea.or.kr/detail/ms_detail.do?cotid=ce6e010f-6adc-4b57-bc01-1e9bfb850b66&big_category=A02&mid_category=A0206&big_area=36
277,신흥레저타운,,"신흥레저타운은 장흥관광지 부근에 있는 복합레저타운이다. 계절에 따라 피크닉월드와 워터월드, 스노우월드를 운영하고 있는데, 유아와 청소년 단체 소풍과 물놀이, 눈썰매를 즐기는 가족 나들이 장소이다. 취사 가능한 수영장&썰매장으로 고기를 구워 먹으며 물놀이와 눈썰매를 즐길 수 있다.
워터월드에는 다양한 종류의 카바나를 대여하고 스노우월드에는 평상과 파라솔 타입의 자리를 대여하는데 파라솔을 제외한 카바나와 평상은 자리마다 콘센트가 있다.
여름 시즌에만 운영하는 워터월드는 물이 깨끗하기로 소문난 곳이다. 특히 카바나는 약 400석에 이른다. 겨울시즌에만 운영하는 스노우월드는 눈썰매와 빙판 얼음 썰매, 빙어 체험 등을 할 수 있으며 실내에 위치한 평상과 파라솔에 짐을 풀고 몸을 녹이며 겨울을 만끽할 수 있다.
송추IC에서 차량으로 약 6분 소요된다. 인근에 장흥유원지, 세계문화유산 온릉, 가나아트파크, 필룩스조명박물관, 회암사지, 북한산국립공원, 국립아세안자연휴양림 등이 있다.",278,https://cdn.visitkorea.or.kr/img/call?cmd=VIEW&id=f2fc70fd-b997-4c48-904b-1a52f35b8490,1,https://korean.visitkorea.or.kr/detail/ms_detail.do?cotid=1459ed8f-85ee-4883-9aca-adba07700c28&big_category=A02&mid_category=A0202&big_area=31
278,황영조 기념공원,,"황영조 기념공원은 1992년 제25회 바르셀로나 올림픽 마라톤 경기에서 우승한 삼척 출신의 황영조 선수를 기념하기 위해 그의 고향 초곡리에 조성되었다. 황영조의 인간승리의 과정과 우승의 감격을 기리고, 청소년들에게는 용기와 꿈을 심어주기 위하여 조성한 기념공원이다. 기념관과 기념탑 등이 들어서 있으며, 이 중 기념관은 건축면적 987㎡, 지하 1층~지상 3층으로 건립되었다.
초곡리가 한눈에 내려다보이는 공원에는 황영조 선수의 동상과 시상대, 생가 등이 전시되어 있으며 매년 기념으로 삼척에서 마라톤 대회가 열리고 있다. 20분 정도면 충분히 둘러볼 수 있어 짧은 관광코스로 적합하며 동해대로를 빠져나와 초곡마을로 내려가는 2차선 도로변에 위치해 있어 드라이브 하기도 좋다.
기념관은 무료로 관람할 수 있다. 1층 제1전시실은 황영조 선수가 올림픽을 제패하기까지의 성장과정과 훈련과정 등을 소개하는 각종 사진 자료가 전시되어 있고, 제2전시실은 올림픽 우승 당시의 기념 사진과 각종 마라톤대회 참가 사진·물품·영상물이 있다. 2층은 기념품 판매장으로 역대 올림픽 포스터들이 전시되어 있으며, 3층은 휴게실이다.",279,https://cdn.visitkorea.or.kr/img/call?cmd=VIEW&id=1c3721c9-41f5-47c1-a285-0b5f3047d7b2,2,https://korean.visitkorea.or.kr/detail/ms_detail.do?cotid=16998dfd-15de-4157-8e47-7b2729f0d828&big_category=A02&mid_category=A0202&big_area=32
279,아양기찻길,,"78년이란 긴 세월 동안 금호강을 가로지르는 아양철교로 운영하던 역사성과 산업문화유산의 가치를 고려해 폐철교를 도심 속 시민문화 여가공간으로 아양기찻길이라는 새로운 관광지로 새롭게 태어났다. 아양기찻길은 길이 277m, 높이 14.2m, 연면적 427.75㎡ 로 전망대와 갤러리 전시장, 디지털 다리 박물관, 카페 등을 갖추고 있으며, 폐철교를 공공디자인과 접목해 복원한 점을 높이 평가받고 독일의 레드닷 디자인 어워드 상을 받고, 현재는 드라마 촬영지로 각광을 받고 있다. 주변에 십리 벚꽃길, 노래비, 동촌유원지, 옹기종기 행복마을을 관광할 수 있다.",280,https://cdn.visitkorea.or.kr/img/call?cmd=VIEW&id=113f0401-02a1-43d5-8c2e-48f46af6ce3c,6,https://korean.visitkorea.or.kr/detail/ms_detail.do?cotid=1ac857f3-9583-459b-8c96-eb3bf5424b77&big_category=A02&mid_category=A0205&big_area=4
280,천불천탑,,"합천 황매산 자락 허굴산에 위치한 천불천탑은 용탑스님이 선사·고대시대 기도한 용바위에서 관세음보살님을 친견한 후 천불천탑의 원력으로 불탑 건립을 하고 있는 소원성지이다.
처음 방문 시 한가지 소원을 색상별 소원리본에 적어서 부처님께 축원 올리는 것을 필수 의무로 하고 있다.
돌탑 속에 앉아서 부처님이 되어보는 부처돌탑, 허굴산 정상에 누워있는 와불부처, 허굴산을 온몸으로 하고 있는 선사·고대시대 기도한 신령스런 소원성취 용바위, 관세음보살님의 위신력으로 형상을 나툰 자연마애불, 천불천탑에서만 볼 수 있는 무수한 돌탑들이 있는 곳으로 가족이나 아이들과 함께, 단체, 관광 드라이브 여행 시 가볼 만한 곳이다.
소원바위인 용바위에 참배 후 용바위를 안고 소원을 염원하여 일주일 안으로 용바위 꿈을 꾸면 소원이 성취되거나, 시험이나 큰일을 앞둔 사람들에게는 마음을 안정시키는 강한 기운을 준다고 해서 많은 사람들이 소원성취 용바위를 찾고 있다.
관세음보살님의 위신력으로 형상을 나툰 자연마애불은 소원초 올려 기도하는 법당으로, 초공양을 올려 기도한 후 소원이 이루어질 것 같으면 기도한 사람들 각각에게 그 형상이 다르게 보여 불가사의한 신비로움을 갖게 한다.
천불천탑은 돌탑이 있는 곳곳마다 법당이고 소원성취 용바위와 자연마애불이 있는 야외법당이 주된 법당이다.",281,https://cdn.visitkorea.or.kr/img/call?cmd=VIEW&id=a81f1dbe-74ec-49dd-9fbe-f542c25dd631,5,https://korean.visitkorea.or.kr/detail/ms_detail.do?cotid=1ceddc58-895c-4faa-a54b-ed44eddc6025&big_category=A02&mid_category=A0205&big_area=36
281,옥계항,,"1987년 5월 8일 옥계도시계획사업(항만)에서 시멘트를 운송하는 항구로 허가를 받아 같은 해 7월 8일 한라시멘트에서 항만건설에 착공하였고, 1991년 10월 14일 대통령령 제13487호에 의해 무역항으로 지정되었고 1997년 12월 8일에 개항하였다. 옥계항은 부두길이가 940m, 방파제가 1,304m, 잔교 1기 등이다. 선박접안능력은 모두 5척으로, 5만 톤급(최대 5만 5천 톤) 1척, 2만 톤급 1척, 1만 톤급 2척, 그리고 5천 톤급 1척 등이다. 연간하역능력은 1,014만 5천 톤이다.

<출처 : 강원도청>",282,https://cdn.visitkorea.or.kr/img/call?cmd=VIEW&id=5e5c39d0-a2d6-466d-ae30-67e68a85f3d7,2,https://korean.visitkorea.or.kr/detail/ms_detail.do?cotid=1e00bcd8-f025-45c3-a2d6-9786dec6e7e8&big_category=A01&mid_category=A0101&big_area=32
282,노산리 솔밭 자연유원지,,"노산리 솔밭 자연유원지는 충북 청주시 서원구 현도면에 자리 잡고 있다. 대청댐에서 하류 쪽으로 약 5㎞ 정도 떨어진 곳에 있으며, 대전 신탄진과 가깝다. 이곳은 대청댐 하류에 위치한 옛 금강 나루터로 40~50년 된 송림과 금강 백사장이 어우러져 하절기에는 해수욕장을 방불케 할 만큼 행락객이 몰리는 강변유원지다.",283,https://cdn.visitkorea.or.kr/img/call?cmd=VIEW&id=3a5583f1-c968-4ce5-8ddd-da2984711634,3,https://korean.visitkorea.or.kr/detail/ms_detail.do?cotid=24942271-b8bd-4eef-8e87-53d0118a0997&big_category=A02&mid_category=A0202&big_area=33
283,갈목해변,,"갈목 해변은 사람들에게 많이 알려지지 않았다. 이 덕분에 번잡하지 않아 여유로운 여행을 즐기기에 제격이다. 백사장의 길이가 700m가량으로 아담하지만, 서해의 풍광을 벗 삼아 해수욕을 즐기기에 좋다. 일몰 무렵에는 서해를 물들이는 노을이 장관을 연출하기도 한다. 이곳은 어패류 보호구역으로 해산물 채취를 금지하고 있지만, 관광객을 위해 마련한 갯벌 체험장에서는 어패류 채취가 가능하다. 해변에서 약 20km 거리에 마량리 동백나무숲과 춘장대 해수욕장이 자리 잡고 있어 연계 관광에 나서기 수월하다.",284,https://cdn.visitkorea.or.kr/img/call?cmd=VIEW&id=7869eadf-0701-4cdc-9e45-aaa04345acf6,3,https://korean.visitkorea.or.kr/detail/ms_detail.do?cotid=27925e52-ea3c-4856-8d96-7f3bdcc5d94f&big_category=A01&mid_category=A0101&big_area=34
284,김녕오조해안도로,,"김녕오조해안도로는 김녕에서부터 성산 오조리까지 이어지는 긴 해안도로로, 일명 해맞이 해안도로로 더욱 잘 알려져 있다. 에메랄드빛 바다, 새하얀 백사장과 풍력발전기도 볼 수 있으며, 올레길 20코스, 21코스, 1코스의 일부가 이 도로를 지난다. 구불구불 이어지는 해안 도로로 다양한 각도에서 다채로운 풍경을 만끽할 수 있다. 저 멀리 느리게 돌아가는 풍력발전기와 해변에서 스노클링과 서핑, 요트, 카약 등 해양 액티비티를 즐기는 사람들까지 한 폭의 그림을 완성한다. 월정리에는 제주도 전통 가옥을 리모델링한 식당과 카페가 많아 들러볼 곳이 많다.",285,https://cdn.visitkorea.or.kr/img/call?cmd=VIEW&id=b299e01c-591b-4b31-88ee-971d2cb8059d,9,https://korean.visitkorea.or.kr/detail/ms_detail.do?cotid=28e394ad-fef0-494b-b1c3-25c47ba34111&big_category=A01&mid_category=A0101&big_area=39
