,Title,Distance,Explain,DriveCourseID,Image,LocalID,URL
387,고래불해수욕장,,"영덕에서 북방으로 24km를 중심으로 영해면 대진해수욕장과 이웃한 고래불해수욕장은 울창한 송림에 에워싸여 있으며, 금빛 모래는 굵고 몸에 붙지 않아 예로부터 여기에서 찜질하면 심장 및 순환기 계통 질환에 효험이 있다는 이야기가 전해져 내려온다. 해변 길이가 8km에 이르는 긴 백사장 덕분에 대진해수욕장과 함께 동해의 명사 20리로 불리며 길고 긴 백사장, 얕은 수심, 깨끗한 에메랄드빛 바닷물, 울창한 송림이 만들어 주는 시원한 그늘로 가족 피서지로 적합하다.
송림 앞에는 고래불국민야영장이 있어 카라반, 캠핑장, 어린이 물놀이장 등과 편의시설이 조성되어 있어 동해안의 대표적인 캠핑장과 해수욕장으로 알려져 있다.
주변에 위정 약수터와 고려 후기 명승 나옹선사가 창건한 장육사가 있으며, 영해면 괴시리에는 고건축물이 산재해 있고, 해안도로를 따라 200년 된 고가옥이 30여 동이나 있는 전통 마을이 있다.
맑고 깨끗한 청정바다로 해안도로의 해맞이공원과 인근 방파제 어느 곳이던 낚시를 드리우면 우럭, 학꽁치, 고등어, 돔 등이 심심찮게 낚인다. 강구에서 고래불까지의 해안도로는 그 경치가 절경으로 해안 드라이브 코스로서 제격이며, 영덕의 특산물인 대게와 맑고 깨끗한 청정해역에서 잡힌 신선한 생선회는 식도락가들의 입맛을 돋운다. 해안도로를 따라 즐기는 해안 절경과 고래불 해수욕장에서 7번 국도를 타고 북쪽으로 쭈욱 달리면 동해안의 유명한 관광지는 거의 다 돌아볼 수 있는 하나의 드라이브 코스가 된다.",388,https://cdn.visitkorea.or.kr/img/call?cmd=VIEW&id=a22f4c6e-0904-422c-9f56-6646ad9b719c,6,https://korean.visitkorea.or.kr/detail/ms_detail.do?cotid=9d8c47a4-a3c1-4273-80a8-33f07a65c1f5&big_category=A01&mid_category=A0101&big_area=35
388,미륵도,,"미륵도는 통영시 남쪽의 섬으로 2개의 다리와 1개의 해저터널로 뭍과 연결돼 있다. 미륵도 여행의 백미라 할 수 있는 23km의 해안 도로인 산양 일주 도로는 아름다운 해안 굴곡과 언덕, 한적한 포구 정경 등 한려수도 바다의 정취를 한껏 만끽할 수 있는 해안 드라이브 코스로 유명하다. 또한 봄철이 되면 도로변에 줄지어 늘어선 동백나무들이 빨간 꽃부리를 펼치며 요염한 자태를 뽐낸다.

일주 도로 기점인 도남동은 마리나리조트 등 해양 레포츠를 즐길 수 있는 곳으로, 인근 한산도, 비진도, 매물도, 거제 해금강 등을 운항하는 유람선 터미널과 부대시설, 숙박시설 등이 갖추어져 있다. 이 도로의 남쪽에 있는 달아공원은 남해의 황홀한 낙조를 감상할 수 있는 곳으로 벤치와 휴게소, 정자(관해정)가 조성되어 있다. 한편 미륵도 한가운데에 있는 용화산(해발 461m)은 남북으로 각각 용화사와 미래사라는 사찰이 있으며, 두 곳 사이로 나있는 호젓한 등산로를 걸어보는 것도 미륵도 관광의 묘미다. 신라 선덕여왕 때 창건됐다는 용화사에는 우리나라에서는 보기 드문 고대 인도의 아쇼카 양식의 원주 석탑인 불사리 사자법륜탑이 있다. 미래사에서는 십자 팔각 누각인 범종각이 눈길을 끈다.",389,https://cdn.visitkorea.or.kr/img/call?cmd=VIEW&id=d930100d-35b0-4fd4-beab-54382828dd94,5,https://korean.visitkorea.or.kr/detail/ms_detail.do?cotid=9dcaec6a-b860-4656-8af7-d64eda93144e&big_category=A01&mid_category=A0101&big_area=36
389,삼덕항,,"삼덕항은 통영시 산양읍에 있는 어항으로 이곳 방파제가 낚시 포인트로 알려져 낚시꾼들의 사랑을 받고 있다. 봄에는 볼락, 여름은 벵에돔, 가을은 감성돔, 겨울은 학꽁치가 특히 많이 잡힌다. 마을에서는 일반인은 살 수 없는 가두리 양식 참돔 위판장이 열리고 있어, 구매를 원할 경우 동네 어민께 부탁하면 저렴하게 살 수 있다. 욕지도에는 유서 깊은 역사와 평균연령 75세의 할매바리스타 카페, 그리고 멋진 절경이 있어, 휴가철이면 욕지도를 찾는 관광객들이 많은데, 이곳에서 출발하는 여객선이 가장 저렴하고 빠른 것으로 알려지고, 주차 요금이 별도로 없어 인기가 높다. 또한 이곳은 통영으로 배낚시를 온 조사들의 출항지로도 유명하다. 주로 감성돔을 많이 낚으며 겨울철에는 낚시마다 과일 열리듯 줄줄이 올라오는 볼락, 열기를 낚는 낚시가 인기 있다. 삼덕항은 소박한 어촌의 풍경이지만, 관광객들과 낚시꾼들을 대상으로 횟집, 식당, 민박, 매점 등이 잘 갖춰져 있고, 인근 미륵도의 해안선을 따라 일주하는 산양일주도로 선상에 있어, 한려수도의 아름다운 해변을 드라이브하기 좋으며, 특히 일몰 무렵에는 낙조가 아주 아름다워 남해의 정취를 느껴 볼 수 있겠다.",390,https://cdn.visitkorea.or.kr/img/call?cmd=VIEW&id=26ca2ae4-6e40-4078-93fb-51430d9b6d49,5,https://korean.visitkorea.or.kr/detail/ms_detail.do?cotid=9f6a7a01-a090-4477-98a5-f726b2cc00c3&big_category=A01&mid_category=A0101&big_area=36
390,사평천,,"전라남도 화순군 한천면 고시리에서 발원하여 사평면을 거쳐 동복천으로 유입하는 하천을 사평천이라고 부른다. 물줄기 대부분이 산지를 따라 흐르기 때문에 맑고 깨끗하다. 특히 봉정산 아래 국도변을 지나는 사평폭포는 여름이면 무더위를 피하기 위해 찾아든 피서객들로 북적인다. 사평폭포로 향하는 사평천을 따라 벚나무가 줄지어 서 있다. 해마다 봄이면 팝콘 터지듯 피어오르는 벚꽃들이 로맨틱한 터널을 이룬다. 봄바람을 따라 천천히 걷기에도, 창문을 열고 드라이브를 즐기기에도 더없이 좋은 시골길이다.",391,https://cdn.visitkorea.or.kr/img/call?cmd=VIEW&id=abc8c060-548c-47c7-977b-77b51bffae1b,7,https://korean.visitkorea.or.kr/detail/ms_detail.do?cotid=a0bc5c0b-b922-43cd-a17b-64ceec3fa88a&big_category=A01&mid_category=A0101&big_area=38
391,독일마을,,남해 독일마을은 파독 광부 간호사들이 은퇴 후 귀국하여 정착한 마을이다. 전통 독일식 주택을 볼 수 있고 독일 교포들이 생활하고 있다. 이 중에서 30여 집 정도가 부업으로 민박을 하고 있다. 집집마다 특색 있는 인테리어와 서비스로 많은 관광객들이 찾는다고 한다. 바로 앞으로 펼쳐진 방조어부림의 시원한 바다와 남해안에서 가장 아름다운 해안 드라이브 코스인 물미해안도로가 있다.,392,https://cdn.visitkorea.or.kr/img/call?cmd=VIEW&id=2b692a8c-367d-4d90-a2d1-8f60c3980351,5,https://korean.visitkorea.or.kr/detail/ms_detail.do?cotid=d79e9827-abf3-44b3-bc01-afd1ddd04017&big_category=A02&mid_category=A0201&big_area=36
392,대진해수욕장,,"영덕군 영해면 해안마을인 대진리를 중심으로 펼쳐진 대진해수욕장은 어디 내놓아도 손색이 없을 만큼 해수욕장으로서의 조건을 두루 갖추고 있다. 맑고 깨끗한 바닷물이 그대로 간직되어 있으며, 길이 8km, 폭 100m의 백사장 뒤로는 송림이 병풍처럼 둘러쳐져 있어 장관을 이루고 있다. 또한, 수심이 1~2m 정도로 깊지 않고 경사도 완만하여 어린이를 동반한 가족단위 피서지로 적당하다.
백사장의 모래는 알이 굵고 질이 좋아 모래찜질에는 그만이며 몸에 잘 붙지 않는 것이 특징이다. 대진해수욕장의 가장 큰 자랑거리는 백사장을 가로질러 흐르는 폭 200m의 송천천이다. 이곳에서는 담수욕을 즐길 수 있어서 천연 샤워장으로도 안성맞춤이다. 또한, 민물과 바닷물이 만나는 곳이라 민물낚시와 바다낚시를 한꺼번에 즐길 수 있고 어족도 풍부한 편이다.
일반적으로 동해안의 해안선을 단조로운 것으로 알고 있지만 축산면 해안만은 예외이다. 산지가 해안에 인접해 있으며, 죽도산 등이 바다로 튀어나와 복잡한 해안선을 그리고 있다. 그 중 대나무 숲이 무성한 죽도산과 동해바다가 어우러진 풍경은 한 폭의 동양화를 떠올릴 만큼 그윽하다. 또한, 축산1리에서 대진해수욕장에 이르는 해안도로는 드라이브를 즐기기에 아주 좋고, 금빛 백사장 위로 하얀 파도가 밀려드는 풍경은 눈부실 정도로 아름답다.",393,https://cdn.visitkorea.or.kr/img/call?cmd=VIEW&id=70e0b548-b806-411c-b086-ecb900d3be00,6,https://korean.visitkorea.or.kr/detail/ms_detail.do?cotid=e43e64df-351c-4002-8d9c-b8f9bf8870ad&big_category=A01&mid_category=A0101&big_area=35
393,안악해수욕장,,"1991년 개장한 해수욕장으로, 해변 길이는 1.5km이며 백사장 길이는 200m에 이른다. 백사장을 에워싼 울창한 소나무 숲은 시원한 그늘을 만들어 여름철 피서객들의 휴식공간으로 더할 나위 없이 좋다. 그리고 함평만이 바라보이는 해수욕장 주변의 해변도로는 석양을 감상하기에 좋아 드라이브 코스로 알려졌으며 안악해변은 특히 일몰 풍경이 일품이다.
매년 해변 개장 기간에는 바닷가의 솔밭과 바로 옆에 펼쳐진 너른 갯벌 속에 파랗고 노란 어린이 풀장을 무료 개방하고 있으며 월촌 어촌계에서 660㎡ 뻘웅덩이에서 진행되는 뱀장어 잡기 행사 또한 관광객들의 높은 호응을 받고 있다. 축구장, 족구장, 배구장, 농구장이 항상 개방되어 있고 저녁에는 플래시만 가지고 지천에 깔려있는 게를 잡는 재미가 쏠쏠하다. 해안가를 따라 산책하거나 자전거를 타며 주변 경치를 감상할 수 있는 등 다양한 체험을 할 수 있는 해수욕장이다.",394,https://cdn.visitkorea.or.kr/img/call?cmd=VIEW&id=e03053c7-e0f3-4dfe-95eb-5c221c7ffdbb,7,https://korean.visitkorea.or.kr/detail/ms_detail.do?cotid=f8f67c56-4887-491d-aeb0-9ea2f691e026&big_category=A01&mid_category=A0101&big_area=38
394,세방낙조 전망대,,진도 해안도로 중에서 가장 아름답다는『세방낙조 전망대』에서 내려다보는 다도해의 경관은 압권이다. 이곳에서 보는 낙조는 환상적이다. 해질 무렵 섬과 섬 사이로 빨려 들어가는 일몰의 장관은 주위의 파란 하늘을 단풍보다 더 붉은빛으로 물들인다. 중앙기상대가 한반도 최남단『제일의 낙조 전망지』로 선정했을 정도이다. 이 해안도로는 다도해의 아름다운 섬들을 한눈에 볼 수 있는 우리나라 최고의 다도해 드라이브 코스다. 많은 숲들과 청정 해역에서 뿜어내는 맑은 공기를 마시면서 드라이브를 즐길 수 있다.,395,https://cdn.visitkorea.or.kr/img/call?cmd=VIEW&id=71133ced-e202-4989-ae33-faa6f44f6563,7,https://korean.visitkorea.or.kr/detail/ms_detail.do?cotid=fc86e41c-03b6-4c9c-bcdb-0150bb6f3a16&big_category=A01&mid_category=A0101&big_area=38
395,황영조 기념관,,"초곡항 근처에 자리하고 있으며, 대한민국의 마라톤 선수인 황영조를 기념하는 기념관이다. 드넓은 동해와 마주한 포구 초곡리는 황영조선수가 나고 자란 고향이다. 그 마을 언덕배기, 바다를 한눈에 내려다볼 수 있는 곳에 황영조 기념관이 자리 잡고 있다. 이 기념관은 1992년 제25회 스페인 바르셀로나올림픽 마라톤을 제패한 황영조선수의 인간승리 과정과 그 전후 이야기를 전시하여 청소년들에게 용기를 심어주기 위해 조성되었다.
기념관은 지하 1층~지상 3층의 건물이다. 1층 제1전시실은 황영조 선수가 올림픽을 제패하기까지의 성장과정과 훈련과정 등을 소개하는 각종 사진 자료들이 전시돼 있으며, 제2전시실은 올림픽 우승 당시의 기념사진과 각종 마라톤대회 참가 사진·물품·영상물이 전시되고 있고 기념품 판매장이 있다. 3층은 휴게실이다.
기념관이 있는 황영조기념공원에는 황영조 선수의 동상과 시상대, 생가 등이 전시되어 있으며, 매년 기념으로 삼척에서 마라톤 대회가 열리고 있다.
20분 정도면 충분히 둘러볼 수 있어 짧은 여행코스로도 적합하다. 동해대로를 빠져나와 초곡마을로 내려가는 2차선 도로변에 위치해 있어 바다 전망을 바라보며 드라이브를 하기에도 좋은 장소이다.",396,https://cdn.visitkorea.or.kr/img/call?cmd=VIEW&id=9c54063d-8d01-419d-8e49-eebb7d844bb9,2,https://korean.visitkorea.or.kr/detail/ms_detail.do?cotid=da3a93f3-2ed1-4d2d-9c9d-4ef4b1330405&big_category=A02&mid_category=A0206&big_area=32
396,어달해변,,"어달해변은 동해시청에서 동북쪽으로 약 3km 거리에 있으며, 백사장 길이 300m, 폭 20~30m에 지나지 않는 조그마한 해수욕장이다. 모래가 곱고 수온이 적당하며, 특히, 2~4도의 경사에 평균 물 깊이도 1m라 가족 휴양지로 알맞다. 새로 개설된 해변 순환도로는 묵호항 인근을 시작으로 어달해변과 대진해변, 노봉해변, 마지막으로 동해 시내 최대 해수욕장인 망상 해변으로 이어지는 해안 드라이브 코스이다. 동해안의 푸른 전경과 함께 천혜의 자연을 만끽할 수 있어 일출로라는 이름이 지어졌다. 근처 횟집 타운의 싱싱한 먹을거리를 즐길 수 있다. 출렁이는 파도 사이에 검은 갯바위들은 더 시원한 파도 소리와 함께 하얗게 일렁이며 멋진 장면을 연출한다. 해안 도로 뒤편으로는 동해안을 내려다보며 바라볼 수 있는 어달산이 있고, 정상에는 동해안을 노략질하던 왜구를 감시했던 강원도 기념물인 어달산 봉수대가 있다.",397,https://cdn.visitkorea.or.kr/img/call?cmd=VIEW&id=531bc49a-c423-42ff-9b24-e5145ec4625b,2,https://korean.visitkorea.or.kr/detail/ms_detail.do?cotid=065bab20-dc4a-4506-91b4-0596bef432fb&big_category=A01&mid_category=A0101&big_area=32
397,진도대교,,"진도군 군내면 녹진과 해남군 문내면 학동사이에 놓인 길이 484m, 폭 11.7m의 국도 18호선인 전국에서 유일한 쌍둥이 사장교로 1984년 10월 18일 준공되어 관광명소로 각광받고 있으며, 2005년 12월 15일 제2의 진도대교가 개통되고 특히 낙조와 야경이 아름답고 다리 아래의 울돌목 물살은 장관을 이룬다. 울돌목은 이충무공의 3대 해전 중의 하나인 명량대첩지로 잘 알려진 서해의 길목으로 해남과 진도 간의 좁은 해협을 이루며 바다의 폭은 한강 너비 정도의 294m 내외이다. 1984년 진도대교의 개통으로 인해 한반도의 최남단 지역이 된 진도는 연간 외국인을 포함하여 약 260만여 명이 찾는 국제적 관광 명소가 되었다. 아름다운 경관과 수많은 특산물 문화예술이 살아 숨 쉬는 고장 진도로 오는 첫 번째 관문이다.",398,https://cdn.visitkorea.or.kr/img/call?cmd=VIEW&id=fcd965a4-1b60-4cd6-9bc7-78ad3f463364,7,https://korean.visitkorea.or.kr/detail/ms_detail.do?cotid=0f931f68-b9f5-43db-b7b6-328ded67a628&big_category=A02&mid_category=A0205&big_area=38
398,금평저수지,,"금산면 금산리에 있는 농업 관개용 저수지로 모악산에서 내려오는 수량으로 인해 마르지 않는 저수지로 알려져 있다. 김제시 금산면 소재지에서 금산사 방향으로 가는 길에 위치한다. 오리알터로 불리는 금평저수지 일대는 야생화 단지와 산책코스가 잘 조성되어 있다. 오리알터는 신라말엽 풍수지리에 밝았던 도선이 장차 오리가 알을 낳을 곳이 될 것이라는 예언을 하여 붙여진 지명이다.
금평저수지는 모악산 명산 만들기 사업의 일환으로 금평곁길탐방로 등을 조성하여 볼거리는 물론 휴식 공간으로 각광을 받고 있다. 총 3.5km의 금평곁길탐방로는 1구간, 2구간, 3구간 세 코스와 제방길로 구성되어 있으며 총 탐방 시간은 약 1시간 정도 소요된다. 1구간은 1km의 수변데크로드와 수변생태숲, 2구간은 0.8km의 수변데크로드, 3구간은 1.2km의 수변데크로드와 자연숲길이다. 제방길은 0.5km의 콘크리트 노면길이다. 무성한 나무 그늘아래 탐방로를 산책하다가 잠시 땀을 식히며 휴식을 취할 수 있는 정자도 수변에 세워져 있다.
금평저수지는 주변에 오염원이 적어 수질이 깨끗하고, 겨울철 우리나라를 찾는 철새 도래지로도 유명하다.",399,https://cdn.visitkorea.or.kr/img/call?cmd=VIEW&id=6c32c718-595e-465c-bffd-1a4ec8216dca,8,https://korean.visitkorea.or.kr/detail/ms_detail.do?cotid=34c8e519-98d0-489d-95bf-764267fd2416&big_category=A01&mid_category=A0101&big_area=37
399,새만금,,"* 새로운 국토의 장, 새만금

‘새만금(새萬金)''이란 명칭은 김제·만경(金堤·萬頃) 방조제를 더 크게, 더 새롭게 확장한다는 뜻에서 예부터 金堤·萬頃평야를 ‘金萬평야''로 일컬어 왔던 ‘금만''이라는 말을 ‘만금''으로 바꾸고 새롭다는 뜻의 ‘새''를 덧붙여 만든 신조어로, 오래 전부터 옥토로 유명한 만경·김제평야와 같은 옥토를 새로이 일구어 내겠다는 의미를 담고 있다. 1987년 11월 2일 당시 정인용 부총리 주재로 관계장관회의에서 황인성 농림수산부 장관이 처음으로 서해안 간척사업을「새만금간척사업」이라는 이름으로 공식 사용되었다. 새만금 방조제에 대하여 새만금간척사업의 1단계 사업으로 건설된 방조제로, 1991년 11월 16일 착공한 후 19년의 공사기간을 거쳐 2010년 4월 27일 준공하였다.

방조제와 간척지 조성이 마무리될 때까지 약 2조 9,000억 원의 사업비가 투여되었으며, 공사가 진행되는 동안 환경오염 문제가 제기되어 새만금간척사업에 대한 찬반 논란이 빚어지면서 물막이 공사를 남겨둔 시점에서 공사가 2차례 중지되기도 하였다.길이 33.9km, 평균 바닥 폭 290m(최대 535m), 평균 높이 36m(최대 54m)로, 세계 최장 방조제로 알려진 네덜란드의 주다치 방조제(32.5km)보다 1.4km 더 길다. 방조제 건설로 인하여 전북특별자치도 군산시·김제시·부안군 공유수면의 401㎢(토지 283㎢, 담수호 118㎢)가 육지로 바뀌었는데 이는 서울시 면적의 3분의 2(여의도 면적의 140배)에 이르는 면적이다. 간척지 조성으로 인하여 한국 국토 면적은 10만 140㎢에서 10만 541㎢로 0.4% 늘었다. 행정구역상 간척지 면적은 군산시 71.1%, 부안군 15.7%, 김제시 13.2%를 차지한다.",400,https://cdn.visitkorea.or.kr/img/call?cmd=VIEW&id=d697ba80-10c3-4984-8dee-763c8d7472ee,8,https://korean.visitkorea.or.kr/detail/ms_detail.do?cotid=4b016d4d-45f7-4644-8f25-fe253b5e2e30&big_category=A02&mid_category=A0202&big_area=37
400,대아저수지(대아호),,"대아저수지는 최초로 1922년 만들어진 대아저수지가 있는 옛 댐에서 300m 하류 지점에 1989년 새 댐을 준공해 만들어진 것이다. 기존의 대아저수지는 일제강점기 독일 기술진이 설계한 아치형 콘크리트 댐으로 우리나라에서 가장 오래된 근대식 댐이다. 준공 후 45년 만인 1967년 누수 방지를 위해 보수공사를 하였으나 심각한 노후화와 절대 용수량의 부족으로 인해 하류 지점에 새로운 댐을 건설하게 되었다.
완주 9경 중 4경에 속하는 대아저수지(대아호)는 기암절벽을 거느린 운장산과 능선이 부드러운 위봉산 계곡을 막아 형성된 곳으로, 주변 산세와 호수가 절묘하게 어우러져 아름다운 자태를 뽐내고 있다. 이뿐만 아니라 대아저수지를 감돌아 동상저수지에 이르는 호반도로는 말끔히 포장되어 드라이브 코스의 운치를 만끽할 수 있다. 두 개의 저수지를 잇는 20km의 호반도로가 관통하는 주변 경관은 사시사철 빼어난 경관을 자랑하고 있다.",401,https://cdn.visitkorea.or.kr/img/call?cmd=VIEW&id=047d1d0d-a6f1-4e20-b214-befdc7a59c8a,8,https://korean.visitkorea.or.kr/detail/ms_detail.do?cotid=4e92292f-ffd0-4caf-841b-fe426d2e5796&big_category=A01&mid_category=A0101&big_area=37
401,소금강 (강원고생대 국가지질공원),,"정선 소금강은 강원도 정선군 화암면과 여량면에 걸쳐 있는 기암괴석의 절경으로, 강원도 8경 중 하나이다. 소금강은 계곡을 따라 기암절벽이 즐비해 마치 금강산을 닮았다고 해서 붙여진 이름이다. 소금강은 강원고생대국가지질공원의 일부로 강을 따라 분포하는 규암이나 사암이 수억 년 동안 지각 변동과 풍화 작용을 받아 이런 기암괴석이 형성되었다. 이 암석은 석영으로 이루어져 있어서 토양으로 변하기 어려워 절벽을 이루고 있다. 소금강에서는 화암면에서 여량면까지 약 4km에 걸쳐 드라이브 코스와 다양하게 조성된 등산로를 따라 소금강의 기암괴석을 가까이에서 감상할 수 있다.
소금강의 대표적인 절경은 다음과 같다.

- 화표주: 소금강의 가장 높은 기암괴석으로, 높이 170m의 거대한 바위이다. 화표주에서 바라보는 소금강의 풍경은 장관을 이루는 것으로 유명하다.
- 몰운대: 높이 100m의 바위인 몰운대는 소금강의 가장 높은 곳에 있으며, 소금강의 전경을 한눈에 내려다볼 수 있는 곳이다. 황동규 시집 [몰운대행]으로도 유명해졌다.
- 미륵바위: 소금강의 가장 아름다운 기암괴석으로, 미륵보살의 모습을 닮았다. 미륵바위는 소금강의 대표적인 사진 명소이다.
- 용소: 높이 30m의 소금강에서 가장 큰 폭포로 소금강의 대표적인 자연경관이며, 많은 사람들이 찾는 곳이다.",402,https://cdn.visitkorea.or.kr/img/call?cmd=VIEW&id=1f9347b7-205e-4047-a848-1bda09eb8784,2,https://korean.visitkorea.or.kr/detail/ms_detail.do?cotid=4f5a0cd0-b308-4d09-8054-0d864654ae48&big_category=A01&mid_category=A0101&big_area=32
402,임해자연휴양림,,"강릉 임해자연휴양림은 전국에서 유일하게 푸른 바다와 산의 정취를 함께 느낄 수 있는 숲속 휴양림이다. 탁 트인 동해안의 푸른 절경이 한눈에 들어오고 병풍처럼 휴양림을 감싸고 있는 괘방산의 아름다운 자연경관이 지친 심신을 치유하고 여유로운 휴식을 안겨줄 수 있는 곳이다.
휴양림 뒤편으로 이어져있는 안보체험 등산로는 바우길 8구간으로 이어져 있으며 등산로를 통해 삼림욕을 즐길 수 있고 해돋이 장관을 감상할 수 있다. 시원한 해안 드라이브 코스와 함께 주변 관광지(통일공원, 정동진 모래시계공원, 안인항, 등명락가사, 하슬라아트월드 등)를 다양하게 즐길 수 있다. 휴양림 숙박시설은 깔끔하고 아담한 콘도형 시설로 내부 취사가 가능하며 숲속동, 구름동, 바다동으로 운영하고 있다.",403,https://cdn.visitkorea.or.kr/img/call?cmd=VIEW&id=8adf6079-6239-4165-8b66-113bab14db23,2,https://korean.visitkorea.or.kr/detail/ms_detail.do?cotid=6ad5fec6-4563-4bd0-9021-9893dbf70c60&big_category=A01&mid_category=A0101&big_area=32
